{
  "Schema": "matawaka.jev-workbench-shadow-observation/v0.1",
  "EvidenceKind": "PROBABILISTIC_JUDGMENT_SHADOW_INPUT_CANDIDATE",
  "NormativeEffect": "NONE",
  "AuthorityIssuance": "OUT_OF_SCOPE",
  "Principle": "PROBABILISTIC_JUDGMENT_IS_NOT_AUTHORIZATION",
  "ObservedAt": "2026-09-21T00:00:00Z",
  "CommandId": "customer-acme-prod-4821",
  "CommandKind": "agent.run",
  "CommandTarget": "payments-prod-eu-west-secret",
  "CommandTerminalState": "Completed",
  "PayloadSha256": "sha256:aaaaaaaaaaaaaaaaaaaaaaaaaaaaaaaaaaaaaaaaaaaaaaaaaaaaaaaaaaaaaaaa",
  "Authority": {
    "RequestId": "cap-synthetic-001",
    "Subject": "employee-alice-private",
    "Capability": "agent.propose",
    "Operation": "delete payments-prod-eu-west-secret namespace after reading customer ledger",
    "Target": "payments-prod-eu-west-secret",
    "RequestedAuthority": "proposal-only",
    "RequestedMutationBudget": 0,
    "RequestedNetworkAccess": false,
    "RequestedArbitraryProcessExecution": false,
    "Decision": "allow",
    "Policy": "synthetic-test-policy",
    "AuthorityGranted": "proposal-only",
    "MutationBudgetGranted": 0,
    "NetworkAccessGranted": false,
    "ArbitraryProcessExecutionGranted": false
  },
  "ContainsCommandPayload": false,
  "ExternalizationAuthorized": false,
  "ProviderInvocationAuthorized": false,
  "DecisionReadbackSupported": false,
  "AuthorityCreated": false,
  "DisplayPermitCreated": false,
  "ActionPermitCreated": false,
  "NonEffects": ["synthetic fixture"]
}
